{
  "schemaVersion": 1,
  "id": "absorb-gypsum-board-air45",
  "name": "せっこうボード 9〜12mm＋空気層45mm",
  "properties": {
    "absorptionOctave": {
      "value": [0.26, 0.13, 0.09, 0.05, 0.05, 0.05],
      "unit": "1",
      "source": {
        "title": "日本建設業連合会 音環境専門部会 用語「吸音率」表1（出典：前川・森本・阪上『建築・環境音響学 第3版』共立出版 2011）",
        "url": "https://www.nikkenren.com/kenchiku/sound/pdf/glossary/ka-0210.pdf",
        "accessed": "2026-10-23"
      },
      "reliability": "二次情報",
      "note": "残響室法吸音率。125・250・500・1000・2000・4000 Hz の順。背後の空気層 45 mm"
    }
  }
}
